[
  {
    "incident_name": "Shai-Hulud npm Worm v1",
    "company": "npm ecosystem (AI/ML packages)",
    "date": "2025-09-15",
    "type": "supply_chain",
    "how": "maintainer_account_takeover",
    "what_exposed": "Developer credentials, CI/CD pipeline access, ~500+ compromised npm packages",
    "accessibility": "taken_down",
    "severity": "critical",
    "urls": [
      "https://unit42.paloaltonetworks.com/npm-supply-chain-attack/",
      "https://www.cisa.gov/news-events/alerts/2025/09/23/widespread-supply-chain-compromise-impacting-npm-ecosystem",
      "https://www.sysdig.com/blog/shai-hulud-the-novel-self-replicating-worm-infecting-hundreds-of-npm-packages/",
      "https://www.stepsecurity.io/blog/ctrl-tinycolor-and-40-npm-packages-compromised",
      "https://www.keysight.com/blogs/en/tech/nwvs/2025/09/23/shai-hulud-the-npm-worm-that-exposes-the-fragility-of-the-software-supply-chain",
      "https://www.blackduck.com/blog/npm-malware-attack-shai-hulud-threat.html"
    ],
    "cve": null,
    "verified": true,
    "date_missing": false,
    "data_classification": "public_sources_only"
  },
  {
    "incident_name": "OpenAI Mixpanel Vendor Breach",
    "company": "OpenAI",
    "date": "2025-11-09",
    "type": "user_data",
    "how": "third_party_vendor_breach",
    "what_exposed": "Names, email addresses, user identifiers, approximate locations, device/browser details",
    "accessibility": "taken_down",
    "severity": "medium",
    "urls": [
      "https://9to5mac.com/2025/11/27/psa-openai-is-notifying-all-users-of-a-data-breach-but-you-probably-arent-affected/",
      "https://www.euronews.com/next/2025/11/27/openai-confirms-chatgpt-data-breach-here-is-everything-we-know",
      "https://openai.com/index/mixpanel-incident/"
    ],
    "cve": null,
    "verified": true,
    "date_missing": false,
    "data_classification": "public_sources_only"
  },
  {
    "incident_name": "PRC Cyber Operation Using Claude-Based Tools",
    "company": "Anthropic (tools misused)",
    "date": "2025-11-13",
    "type": "state_sponsored_misuse",
    "how": "ai_assisted_autonomous_operations",
    "what_exposed": "U.S. systems compromised via Claude-based AI tools by Chinese state-sponsored actors",
    "accessibility": "live",
    "severity": "critical",
    "urls": [
      "https://homeland.house.gov/2025/11/26/homeland-republicans-request-anthropic-google-quantum-xchange-testimony-following-report-of-ai-assisted-partially-autonomous-prc-cyber-operation/",
      "https://cybernews.com/ai-news/china-spies-ai-attack/"
    ],
    "cve": null,
    "verified": true,
    "date_missing": false,
    "data_classification": "public_sources_only"
  },
  {
    "incident_name": "Shai-Hulud npm Worm v2.0",
    "company": "npm ecosystem",
    "date": "2025-11-03",
    "type": "supply_chain",
    "how": "typosquatting_automated_replication",
    "what_exposed": "25K+ repositories with automated propagation",
    "accessibility": "taken_down",
    "severity": "critical",
    "urls": [
      "https://securitylabs.datadoghq.com/articles/shai-hulud-2.0-npm-worm/",
      "https://www.netskope.com/blog/shai-hulud-2-0-aggressive-automated-one-of-fastest-spreading-npm-supply-chain-attacks-ever-observed",
      "https://www.wiz.io/blog/shai-hulud-2-0-ongoing-supply-chain-attack",
      "https://www.microsoft.com/en-us/security/blog/2025/12/09/shai-hulud-2-0-guidance-for-detecting-investigating-and-defending-against-the-supply-chain-attack/",
      "https://www.elastic.co/blog/shai-hulud-worm-2-0-updated-response",
      "https://jfrog.com/blog/shai-hulud-npm-supply-chain-attack-new-compromised-packages-detected/",
      "https://www.reversinglabs.com/blog/shai-hulud-worm-npm"
    ],
    "cve": null,
    "verified": true,
    "date_missing": false,
    "data_classification": "public_sources_only"
  },
  {
    "incident_name": "Claude Code CVE-2025-59536 (RCE via Project Files)",
    "company": "Anthropic",
    "date": "2026-02-01",
    "type": "source_code",
    "how": "rce_via_hooks",
    "what_exposed": "Remote Code Execution through hooks in project files",
    "accessibility": "patched",
    "severity": "critical",
    "urls": [
      "https://research.checkpoint.com/2026/rce-and-api-token-exfiltration-through-claude-code-project-files-cve-2025-59536/",
      "https://thehackernews.com/2026/02/claude-code-flaws-allow-remote-code.html",
      "https://www.darkreading.com/application-security/flaws-claude-code-developer-machines-risk",
      "https://www.securityweek.com/claude-code-flaws-exposed-developer-devices-to-silent-hacking/",
      "https://www.theregister.com/2026/02/26/clade_code_cves/"
    ],
    "cve": "CVE-2025-59536",
    "verified": true,
    "date_missing": false,
    "data_classification": "public_sources_only"
  },
  {
    "incident_name": "Claude Code CVE-2026-21852 (API Key Exfiltration)",
    "company": "Anthropic",
    "date": "2026-02-01",
    "type": "api_keys",
    "how": "anthropic_base_url_substitution",
    "what_exposed": "API key exfiltration via ANTHROPIC_BASE_URL substitution",
    "accessibility": "patched",
    "severity": "high",
    "urls": [
      "https://hackernoon.com/claude-code-security-analysis-understanding-the-cve-2026-21852-api-key-exfiltration-vulnerability",
      "https://www.penligent.ai/hackinglabs/claude-code-project-files-became-an-rce-and-api-key-exfiltration-path-what-the-check-point-findings-change-for-ai-coding-assistants/",
      "https://cybernews.com/security/claude-code-critical-vulnerability-enabled-rce/",
      "https://www.technadu.com/claude-code-critical-flaws-allowed-rce-and-api-token-theft-ai-development-security-risks-exposed/621031/"
    ],
    "cve": "CVE-2026-21852",
    "verified": true,
    "date_missing": false,
    "data_classification": "public_sources_only"
  },
  {
    "incident_name": "TeamPCP Cascading Supply Chain Attack",
    "company": "Multiple (Aqua Security, Checkmarx, LiteLLM, Telnyx)",
    "date": "2026-03-08",
    "type": "supply_chain",
    "how": "multi_stage_zero_day_cascade",
    "what_exposed": "Trivy vulnerability scanner zero-day, CI/CD worm, LiteLLM proxy compromise, VoIP API abuse",
    "accessibility": "patched",
    "severity": "critical",
    "urls": [
      "https://www.sysdig.com/blog/teampcp-expands-supply-chain-compromise-spreads-from-trivy-to-checkmarx-github-actions",
      "https://www.reversinglabs.com/blog/teampcp-supply-chain-attack-spreads",
      "https://www.sans.org/blog/when-security-scanner-became-weapon-inside-teampcp-supply-chain-campaign",
      "https://www.microsoft.com/en-us/security/blog/2026/03/24/detecting-investigating-defending-against-trivy-supply-chain-compromise/",
      "https://www.paloaltonetworks.com/blog/cloud-security/trivy-supply-chain-attack/",
      "https://arcticwolf.com/resources/blog/teampcp-supply-chain-attack-campaign-targets-trivy-checkmarx-kics-and-litellm-potential-downstream-impact-to-additional-projects/",
      "https://www.trendmicro.com/en/research/26/c/inside-litellm-supply-chain-compromise.html",
      "https://www.infosecurity-magazine.com/news/teampcp-litellm-pypi-supply-chain/",
      "https://www.helpnetsecurity.com/2026/03/30/teampcp-supply-chain-attacks-ransomware/",
      "https://labs.cloudsecurityalliance.org/research/csa-research-note-ai-pypi-supply-chain-campaign-20260329-csa/",
      "https://thenewstack.io/teampcp-trivy-supply-chain-attack/",
      "https://cybermagazine.com/news/inside-teampcps-sophisticated-supply-chain-attack-on-trivy"
    ],
    "cve": null,
    "verified": true,
    "date_missing": false,
    "data_classification": "public_sources_only"
  },
  {
    "incident_name": "Meta AI Agent Rogue Data Breach (SEV1)",
    "company": "Meta",
    "date": "2026-03-20",
    "type": "user_data",
    "how": "ai_agent_autonomous_disclosure",
    "what_exposed": "Proprietary code, business strategies, user datasets autonomously disclosed",
    "accessibility": "contained",
    "severity": "critical",
    "urls": [
      "https://winbuzzer.com/2026/03/20/meta-ai-agent-rogue-data-breach-sev1-xcxwbn/",
      "https://www.aicerts.ai/news/metas-agent-data-breach-inside-the-rising-ai-exposure-crisis/"
    ],
    "cve": null,
    "verified": true,
    "date_missing": false,
    "data_classification": "public_sources_only"
  },
  {
    "incident_name": "Anthropic Mythos/Capybara CMS Leak",
    "company": "Anthropic",
    "date": "2026-03-26",
    "type": "training_data",
    "how": "cms_misconfiguration",
    "what_exposed": "~3,000 unpublished assets from Sanity CMS - draft blogs, internal strategic documents, unreleased model tier specs",
    "accessibility": "taken_down",
    "severity": "high",
    "urls": [
      "https://fortune.com/2026/03/26/anthropic-leaked-unreleased-model-exclusive-event-security-issues-cybersecurity-unsecured-data-store/",
      "https://fortune.com/2026/03/26/anthropic-says-testing-mythos-powerful-new-ai-model-after-data-leak-reveals-its-existence-step-change-in-capabilities/",
      "https://fortune.com/2026/03/27/anthropic-leaked-ai-mythos-cybersecurity-risk/",
      "https://letsdatascience.com/news/anthropic-exposes-unreleased-model-in-security-lapse-e97977c6",
      "https://www.coindesk.com/tech/2026/03/28/here-s-what-next-as-anthropic-s-most-powerful-ai-model-leaked-via-unsecured-data-cache/",
      "https://pureai.com/articles/2026/03/30/anthropic-leak-reveals-advanced-ai-model-and-internal-safety-concerns.aspx",
      "https://winbuzzer.com/2026/03/27/anthropic-confirms-leaked-mythos-model-step-change-reasoning-xcxwbn/",
      "https://the-decoder.com/anthropic-confirms-leaked-model-marks-a-step-change-in-reasoning-after-data-breach-reveals-its-existence/"
    ],
    "cve": null,
    "verified": true,
    "date_missing": false,
    "data_classification": "redacted_internal_data"
  },
  {
    "incident_name": "Axios npm Hijack",
    "company": "npm ecosystem (axios)",
    "date": "2026-03-31",
    "type": "supply_chain",